{
  "schemaVersion": 1,
  "name": "reference-ocean",
  "base": "dark",
  "styles": {
    "title": {
      "foreground": "#d8f3ff",
      "bold": true
    },
    "accent": {
      "foreground": "#56b6c2"
    },
    "assistant": {
      "foreground": "#98c379"
    },
    "success": {
      "foreground": "#7bd88f"
    },
    "selection": {
      "foreground": "#071b26",
      "background": "#61afef",
      "bold": true
    }
  }
}
